<?xml version="1.0" encoding="UTF-8" ?>
<tienda xmlns:xsi="http://www.w3.org/2001/XMLSchema-instance"
xsi:noNamespaceSchemaLocation="ejercicio5xsd.xsd">
    <departamentos>
        <departamento>
            <nombre>Zapatillas</nombre>
        </departamento>
        <departamento comentario="sin encargado">
            <nombre>Guantes</nombre>
        </departamento>
    </departamentos>
    <productos>
        <producto id="p0015">
            <nombre>Zapatillas Trekking</nombre>
            <precio moneda="euros" descuento="si">30.50</precio>
        </producto>
        <producto id="p0016">
            <nombre>Zapatillas Basquet</nombre>
            <precio moneda="pesetas" descuento="si">25.95</precio>
        </producto>
        <producto id="p0045">
            <nombre>Guantes esqu√≠</nombre>
            <precio>16</precio>
        </producto>
    </productos>
</tienda>